{
  "$schema": "../../../../../schemas/candidate-manifest.schema.json",
  "schema": "mathematics-commons-stacks-candidate-manifest/v1",
  "candidate_id": "stacks-errata-a04446e-r3",
  "lease_id": "stacks-lease-000006-errata-r3",
  "namespace": "commons/stacks/errata/r3",
  "writer_task": "01a0256d-5693-77c1-96b2-cf37101e0c6c",
  "upstream": {
    "lock": "upstream/stacks.lock.json",
    "commit": "a04446e57ec1fbc252a871afcec7752fb2807b14",
    "tree": "3feeb703b931a6e7259782c10e7d1575adc83e5e"
  },
  "source_authorities": [
    {"path":"authority/upstream.lock.json","sha256":"B195ECC83AB0F32C574A60D1FDBA9B0DA4D35B04E0DF7CB106DC9C0FDAD99C0D","source_url":"https://github.com/stacks/stacks-project/tree/a04446e57ec1fbc252a871afcec7752fb2807b14"},
    {"path":"authority/COPYING","sha256":"4B2C8FC390F802CD92F0622DC00A708A588BEC54D0145D2EE135D6D7672BFE85","source_url":"https://raw.githubusercontent.com/stacks/stacks-project/a04446e57ec1fbc252a871afcec7752fb2807b14/COPYING"},
    {"path":"authority/source/sets.tex","sha256":"9BCC55E7F11CF36B0665AE549D5BA76BE6A0EDD00F7FCA36A567E367099603F9"},
    {"path":"authority/source/topology.tex","sha256":"C6BAC8DCF8AD96DC47416BF34CB45BA4A10B894E40D67D3E1FA68D8EF0D9F872"},
    {"path":"authority/source/categories.tex","sha256":"62F7611AF4C3FEEBD041DB4728B42C7112004CFBB9FA5ECB643C6F5D90DB3F25"},
    {"path":"authority/canon/ERRATA_R3_INTAKE_FRENCH_20260822.json","sha256":"1CBD6FC2A3F503AD86F2ADCF480FD04FE22B37B633590ECF6BCEA079D55FF160"},
    {"path":"authority/canon/ERRATA_R3_PROOFS.md","sha256":"2DB6FC82A46EE3454A07337AD5F5D0C4E6A61A2381F0F45892B2E4137457897E"},
    {"path":"authority/canon/R3_TOPOLOGY_018_023_INDEPENDENT_REVIEW.md","sha256":"E92AB3262E4D5506DBABF36CF5522F8D323ABA3CD379258B6E65D872838B1FB3"},
    {"path":"authority/producer/SOURCE_DEFECT_LEDGER.csv","sha256":"CD91D317D52D999D5174E945F735D32E831DB9F3DB6B8F121B83EF9D6F260F45"}
  ],
  "source_closure": {
    "enumerated": true,
    "expected_units": 34,
    "manifested_units": 34,
    "complete": true
  },
  "stable_unit_manifest": {"path":"stable-units.json","sha256":"F29F90BD0D372120E5037926E6C7D554E39E2DF65488768EA710C6C6974F644F"},
  "source_map": {"path":"source-map.jsonl","sha256":"65F1CE7CD5C39DF836C059EEB48279A2686A7AE36777914323504B8CA6186F1C"},
  "decision_ledger": {"path":"decisions.jsonl","sha256":"964AB23B1731EB946B628F00ED9E394580F09CF0D49CA61405C29853A562719E"},
  "rejection_ledger": {"path":"rejections.jsonl","sha256":"A8EDC255B231B632EE13F692D1CA146EBC1B16EAA181F0F64CC754A83BBEE52A"},
  "formula_diagram_inventory": {"path":"formula-diagram-inventory.json","sha256":"ECB34F7F8B2A942576C6A256B92E456ECC67798AF7BDD5CD684D08D404A10E60"},
  "builds": [
    {"path":".gitattributes","sha256":"705FD4D6451A31D36B3DF7DE96F83F30AC976C9B4A6D1E51671D8E2F33E2D0DA"},
    {"path":"README.md","sha256":"2692F35163878EA09C893C76B8E110BEA2F8B8E90B772935F52E5141122F46A2"},
    {"path":"BUILD.md","sha256":"B1D82FEE014208F9F71674DD284B37501B9FDFD78946EE763004A2D30F190F83"},
    {"path":"LEASE.json","sha256":"B862C5607B50ED4213BC0C5544AEFF838B8F5B88C7B06BB21166B26D529B9BF8"},
    {"path":"replay-build.py","sha256":"A63E4FA0ABEEEDB59CDF0D7119A2CFE549CF4132B23A27F952BE2985DE036A6A"},
    {"path":"build-receipt.py","sha256":"1DD044EAF63D4160186293FFEE1501EAA5AC17215CA277B6790865A8E3AA2C83"},
    {"path":"verify.py","sha256":"D54B5FDA12775C872AEB8F0315DD2E1F7316935CE320553AF00C3A7B6E5FACE4"},
    {"path":"payload/sets.tex","sha256":"A4D8072BDFFEEF9B8EF1D058499761DA1E1F31EABC11BB04B8EA37D04B866D41"},
    {"path":"payload/topology.tex","sha256":"67115451F19CE981FD591F77E6CA16A4DE64A20C71105D2E5215E41FD8F8EB8D"},
    {"path":"payload/categories.tex","sha256":"124F381C9DD01898B8DBB3969B7771190B64E8B2B9CE73E24E7DD1FB0727E2C1"},
    {"path":"builds/build-execution.json","sha256":"36F511352D484C1296E51FE5714585E58AF10E4918A2B6B7A182C6EFDA10C784"},
    {"path":"builds/build-receipt.json","sha256":"D62C323D31CAE3A54E258B7BF695D14007EF6031C4CACB21C43E3371DA3E32C8"},
    {"path":"builds/validation.json","sha256":"8582A954A528620AD93A3E8774F2B46B9DF08FE2CE6B7345C205F14A95394465"},
    {"path":"builds/visual-qa.json","sha256":"2A5EC193261F2B22E39B71BE6D384039949627B795AAD47277E227F00242890F"},
    {"path":"replay/failed-review-pre-revision.json","sha256":"B558A16BD22D5E0076EAA724B358B9CC2239488BD6EDA29B281CD0179895ED6F"},
    {"path":"replay/independent-review.json","sha256":"6438F665BF977F460FD9A5F13747D1076C0388C84ABCB27EAC19D319043DE6CC"},
    {"path":"builds/sets.pdf","sha256":"7FFA758C1F3431B23D2267DA299794F744763CB25ACBFBFBABC24D3CA2D2B44D"},
    {"path":"builds/sets.log","sha256":"EA72017BF48C51774748AEBA977C41170ECEED1D10DB4A60CA8A97167923BA7F"},
    {"path":"builds/sets.pass3.txt","sha256":"1E5844718A5DCDEA98D4E030B2CB3B05658FEFE53B11F85EB4D6DEC1025C2882"},
    {"path":"builds/sets.bibtex.txt","sha256":"EC7BFEF49E51B36B4DC1D306A1A9841AF289A981FE1D16B3126E0B3F92230602"},
    {"path":"builds/sets.authority.pdf","sha256":"7B43FF1D59E1F7FAD25BF9E262D936A586A89F61294188C537FF09251534DE45"},
    {"path":"builds/sets.authority.log","sha256":"7C7480DB458B5DD42E16AA707DF3D0658E484F0F0C5416BC25FCA17862193E12"},
    {"path":"builds/sets.authority.pass3.txt","sha256":"3D70D5B56111353ABF40CDDFBC188EC197C8F326F157F62E134B867ABDC8D05D"},
    {"path":"builds/sets.authority.bibtex.txt","sha256":"EC7BFEF49E51B36B4DC1D306A1A9841AF289A981FE1D16B3126E0B3F92230602"},
    {"path":"builds/topology.pdf","sha256":"12D3AAA2FF48760189757D1E6DC951A18446BD72186A0B056AE7B840D8D152B7"},
    {"path":"builds/topology.log","sha256":"D997C458D7B02ECFD870386ECAE2FFC2A5E2DF85B5E1BD597B91CE4FCA5D836F"},
    {"path":"builds/topology.pass3.txt","sha256":"84862AA55C7A5673408BC1C5E8D407822A58474C7047F2D36DD752CCA7ADD20A"},
    {"path":"builds/topology.bibtex.txt","sha256":"8FEFD69AECFB5B8563CE82B1C038CB9D926796AAA327C58EA2EF0395D3DF0C85"},
    {"path":"builds/topology.authority.pdf","sha256":"C0111D47873DE622732C525D93773636961A1D154B58B1341C02DE7F7FD44BE2"},
    {"path":"builds/topology.authority.log","sha256":"9DE299B97CC5FBC7B9824C2E6DEBF402E61B258E0EC450FE4EF2C9018C032319"},
    {"path":"builds/topology.authority.pass3.txt","sha256":"D072250864CA99AE2B7E6D7274F43C09A1725E957550DBD486D10C02CA3B5A40"},
    {"path":"builds/topology.authority.bibtex.txt","sha256":"8FEFD69AECFB5B8563CE82B1C038CB9D926796AAA327C58EA2EF0395D3DF0C85"},
    {"path":"builds/categories.pdf","sha256":"6374342AD1EFD455D14EA4C1B1C67B53CB6805F29736F3CF9B3EDE5958E0E6A6"},
    {"path":"builds/categories.log","sha256":"DE25481C65EE3BCEC9C88455ACD72C56BDD2F2E72AB9A88B86588AE2BA06EF8A"},
    {"path":"builds/categories.pass3.txt","sha256":"B2F0AB21CCD285C8B296FC4E60916A14A536BCCC22BC902C672D90E0436FCBE1"},
    {"path":"builds/categories.bibtex.txt","sha256":"4C043470CE98C5EFE53DA972DC07669180FAAB4579721E6BFB1025173819711A"},
    {"path":"builds/categories.authority.pdf","sha256":"DC246D1C7885AED71F458EFD1DAF7B40D0AC02A24F8D69A5EB5D3CEB4080C6BF"},
    {"path":"builds/categories.authority.log","sha256":"ADF0A6C3535872A1665D55796769AF388E0C7F35247DE3B107F890FF9CDCE982"},
    {"path":"builds/categories.authority.pass3.txt","sha256":"AA2049E9C4C65A50C86C0E3AF0BAC99E16E6060617FE84B04E69C50992E42215"},
    {"path":"builds/categories.authority.bibtex.txt","sha256":"4C043470CE98C5EFE53DA972DC07669180FAAB4579721E6BFB1025173819711A"}
  ],
  "rights_state": "The authority and modified payload retain the Stacks Project GNU Free Documentation License 1.2; metadata and receipts do not relicense upstream content. This is an independently maintained AI-produced English-edition candidate with no Stacks Project review, approval, affiliation, or endorsement. Legal certification was not performed.",
  "review_state": "performed",
  "independent_replay": "passed",
  "unresolved_defects": [
    "The first independent replay failed MC-STK-ERR-0030 and MC-STK-ERR-0031; its immutable adverse receipt remains preserved. A wholly fresh replay of the revised linked units and all 34 corrections subsequently passed and is bound by replay/independent-review.json.",
    "The independent-review receipt binds validation bytes produced immediately before that receipt existed (866F4102CC23C4D656E35B0D26EDE4E95274356ED0C0D2155E9EE0236F08F317). The final manifest binds the subsequent canon rerun (8582A954A528620AD93A3E8774F2B46B9DF08FE2CE6B7345C205F14A95394465), which also passed and differs only because the public-hygiene text-file count now includes the new receipt.",
    "The isolated proof builds retain the same cross-chapter undefined-reference sets as their byte-bound authority builds; only a full-corpus build can resolve them.",
    "The proof PDFs are untagged; accessibility tagging remains a full-edition toolchain concern.",
    "The append-only R4 queue, including later topology and sheaves hypotheses, is outside this frozen R3 candidate and remains unproved.",
    "Canonical Chinese, Japanese, Korean, and French translations continue to preserve the frozen authority rather than silently incorporating this English corrected overlay.",
    "Overlay admission and English-edition composition are separate transitions; this candidate manifest records replay closure only."
  ],
  "stop_conditions": [
    "Do not mutate the literal stacks-project master mirror.",
    "Do not apply these corrections silently to canonical translation source or PDFs.",
    "Do not contact or submit to the upstream Stacks maintainers under the current no-AI-contribution boundary.",
    "Do not append an overlay registry record except in a separate admission commit bound to the final manifest hash and a passed independent replay.",
    "Any change to reviewed authority, payload, proof, build, validation, visual-QA, or replay bytes invalidates the replay and requires a new review."
  ],
  "generated_at_utc": "2026-08-22T04:11:33Z"
}
