{
  "$schema": "../../../../../schemas/candidate-manifest.schema.json",
  "schema": "mathematics-commons-stacks-candidate-manifest/v1",
  "candidate_id": "stacks-errata-a04446e-r2",
  "lease_id": "stacks-lease-000005-errata-r2",
  "namespace": "commons/stacks/errata/r2",
  "writer_task": "01a0256d-5693-77c1-96b2-cf37101e0c6c",
  "upstream": {
    "lock": "upstream/stacks.lock.json",
    "commit": "a04446e57ec1fbc252a871afcec7752fb2807b14",
    "tree": "3feeb703b931a6e7259782c10e7d1575adc83e5e"
  },
  "source_authorities": [
    {"path":"authority/upstream.lock.json","sha256":"B195ECC83AB0F32C574A60D1FDBA9B0DA4D35B04E0DF7CB106DC9C0FDAD99C0D","source_url":"https://github.com/stacks/stacks-project/tree/a04446e57ec1fbc252a871afcec7752fb2807b14"},
    {"path":"authority/COPYING","sha256":"4B2C8FC390F802CD92F0622DC00A708A588BEC54D0145D2EE135D6D7672BFE85","source_url":"https://raw.githubusercontent.com/stacks/stacks-project/a04446e57ec1fbc252a871afcec7752fb2807b14/COPYING"},
    {"path":"authority/source/brauer.tex","sha256":"B2504820D769EBE4E9E33B8ADD78753FB30ACA6E8A7F75C8D54DDA885EDCD682"},
    {"path":"authority/source/stacks-limits.tex","sha256":"F4F5EBF02BB5922A8DFF70EA507ED6F821F992C697D9C9A984B9513C39FEC57A"},
    {"path":"authority/canon/ERRATA_LEDGER.jsonl","sha256":"A1713294427EC2520A313A54F674F324FB90CA4DA58E08F5D0481CFC10737100"},
    {"path":"authority/canon/ERRATA_R2_PROOFS.md","sha256":"474EF7ED07DBC0F139A528AA7F0FBD2C9C6D37F2B91231C47287F83C94F4CDD4"},
    {"path":"authority/canon/INTAKE_P02_CH11_20260821.json","sha256":"7DABA01CC441F6406EF8AB16F4205A4F95B422260C0B476606A31464C84B45A3"},
    {"path":"authority/canon/INTAKE_P12_CH102_20260821.json","sha256":"5AF5BB6F92EA2228B46041BE71103B280349358E56DCA7C7EA577BF628059E32"},
    {"path":"authority/producer/QA_ZH_CH11.json","sha256":"94CE6E9BB178A3CF26FCB08B1ECA2278D5F882138553A594A716C6CE9111A145"},
    {"path":"authority/producer/CH102_ZH_QA.json","sha256":"FE0D6D2D5D5E3D64F592A035A8B8F61BE7B44F1F33C31BC800FDBE6FB327A121"}
  ],
  "source_closure": {
    "enumerated": true,
    "expected_units": 13,
    "manifested_units": 13,
    "complete": true
  },
  "stable_unit_manifest": {"path":"stable-units.json","sha256":"0D850931A684786F58D8AAFB4B1A84DBE3799B090D17B35234CA090D6B99D893"},
  "source_map": {"path":"source-map.jsonl","sha256":"EDF1151985BD1ECD17B088A156C49B6240B4B7C59226A091B7FA13ABD7E1AF03"},
  "decision_ledger": {"path":"decisions.jsonl","sha256":"01CE32439E7DD871C3830B1B8B7110148F83CEBE428F60459FFD810EAA3E0AA8"},
  "rejection_ledger": {"path":"rejections.jsonl","sha256":"2C1A71DCC56CEC42E1E3AF8CDF922C211A482FA19577F6E97738819E5F502898"},
  "formula_diagram_inventory": {"path":"formula-diagram-inventory.json","sha256":"D8ACCE6AD435119E804915BDDB1ECF90C8CAE94B462ACD08D76F01222E505209"},
  "builds": [
    {"path":".gitattributes","sha256":"705FD4D6451A31D36B3DF7DE96F83F30AC976C9B4A6D1E51671D8E2F33E2D0DA"},
    {"path":"README.md","sha256":"710B236D97D9796DF6D769B50FC7AAB33D02BC0CFBCFC88B957F8EBC29CF7E57"},
    {"path":"BUILD.md","sha256":"6CE8F7EE637DD0626F2D3A7DBFCC19E3AED34FF863B0A82871AE63C7816C116D"},
    {"path":"LEASE.json","sha256":"0746D7391E465E97E1F3004AF237DFFA683D8895882470BB8E5E9E58EC3D0AE7"},
    {"path":"replay-build.py","sha256":"260B5FE24FE989C5536AB6CFBE472E35C0E874DD56B95963FF3275ECC8F7B206"},
    {"path":"build-receipt.py","sha256":"BB1AB3E0D461F60416DF361C26D13716F468ACCC28DBF1C0E94AED44643F16CF"},
    {"path":"verify.py","sha256":"88A739931FC4BFA8654C281BBC8C287301896035C08929D9E4C794444979CDAA"},
    {"path":"payload/brauer.tex","sha256":"7D14F300ED13295728D3BA0B08ABEB5449B93D4E64244FA91680BEA9DA785BBD"},
    {"path":"payload/stacks-limits.tex","sha256":"0FBB14083DB31197467F9A638216D3273BAE7520623E99B9ED884B043BF12003"},
    {"path":"builds/build-execution.json","sha256":"FB11AE2D6BF5A597B48E1802195788E65139AB082DD4DE03F31D7928D66C5937"},
    {"path":"builds/build-receipt.json","sha256":"B1DB59C778F4FFDFD94B2E5BE1839107605D11E804920CF1D1C3059D85B69128"},
    {"path":"builds/validation.json","sha256":"B5F6D5267B163EBD6F9A32CBE97FE7B34CA276A2D866002E2E130B8E36F1CCE4"},
    {"path":"builds/visual-qa.json","sha256":"7D031AD1552709E03926BA2EC099B51B9741BB53D9A2D986BD319DA970F9A983"},
    {"path":"replay/independent-review.json","sha256":"0E9B384EE4D2BD7DE4A171148B98976AA604893C76997DF29512EBEB15297141"},
    {"path":"builds/brauer.pdf","sha256":"11DBAF837AAD0F8AA6BBD6537ADA14E326DFBF166F6B3E98280790F0A0F6CBF4"},
    {"path":"builds/brauer.log","sha256":"4DDF2CA8184AEB2CBF51A0E4E3F625B2A3FAE7430BDC38B845CE4E0D1A639048"},
    {"path":"builds/brauer.pass3.txt","sha256":"A2AE5014F656104271FBEC45BBC74F379942FDD38518F928B5AFFF5AD41DBC35"},
    {"path":"builds/brauer.bibtex.txt","sha256":"9AE9600D98A09635E7D6E137B2A6F4EBED9D28A002A4A49798CA2DC3CEEA4C52"},
    {"path":"builds/brauer.authority.pdf","sha256":"3BB40F4A15DE154631CC14900EECD90F12BD59C71F880BC3E2DEF5FC308E0487"},
    {"path":"builds/brauer.authority.log","sha256":"9BADC1403A6324204CFEAE984DDE1D78679D5FB282433150992AB5E8C393F226"},
    {"path":"builds/brauer.authority.pass3.txt","sha256":"14916955624A86F4F63B8773386CD8F97ACE2F18DA4E22CFBB073B209E5B98EB"},
    {"path":"builds/brauer.authority.bibtex.txt","sha256":"9AE9600D98A09635E7D6E137B2A6F4EBED9D28A002A4A49798CA2DC3CEEA4C52"},
    {"path":"builds/stacks-limits.pdf","sha256":"6A2688A4BBB5C89C4EAF2C6E5B477CD7F1F77095399184F969BEADB56DBBD3A6"},
    {"path":"builds/stacks-limits.log","sha256":"3E2B3E66ACD04E2A36A4E1AD0E0561C71EC4D79459154E75A71204E4C99124E3"},
    {"path":"builds/stacks-limits.pass3.txt","sha256":"CC4F73114C05E83D1AB73B8956748112A11AA00F9C8EA51396CEC4107B49E4BB"},
    {"path":"builds/stacks-limits.bibtex.txt","sha256":"F5DD99B97ADC6FA948CDFF17E74B17D1619FAB37C9F3BBCFF36C9F06A4E9E085"},
    {"path":"builds/stacks-limits.authority.pdf","sha256":"F4C3DECCF47A5B4090268C4CD486CF9C51B5E0D559BB90D101C7F1CC3A2094C7"},
    {"path":"builds/stacks-limits.authority.log","sha256":"636A9925B4B4056471344BBB9DF5EF8FB1B66C0F0FF865152DDD4550B6DC8308"},
    {"path":"builds/stacks-limits.authority.pass3.txt","sha256":"8B34C5674AB0F197742D5090D0FA7BBB7CA726A60F9423C61B62840C74ED5F57"},
    {"path":"builds/stacks-limits.authority.bibtex.txt","sha256":"F5DD99B97ADC6FA948CDFF17E74B17D1619FAB37C9F3BBCFF36C9F06A4E9E085"}
  ],
  "rights_state": "The authority and modified payload retain the Stacks Project GNU Free Documentation License 1.2; metadata and receipts do not relicense upstream content. This is an independently maintained AI-produced English-edition candidate with no Stacks Project review, approval, affiliation, or endorsement. Legal certification was not performed.",
  "review_state": "performed",
  "independent_replay": "passed",
  "unresolved_defects": [
    "The isolated proof builds retain the same cross-chapter undefined-reference sets as their byte-bound authority builds; only a full-corpus build can resolve them.",
    "The isolated proof PDFs are untagged; accessibility tagging remains a full-edition toolchain concern.",
    "The later French sets/topology candidate packet remains an unproved R3 queue and is not included in this frozen R2 candidate.",
    "Overlay admission and English-edition composition are separate transitions and are not claimed by this candidate."
  ],
  "stop_conditions": [
    "Do not mutate the literal stacks-project master mirror.",
    "Do not apply these corrections silently to canonical translation source or PDFs.",
    "Do not contact or submit to the upstream Stacks maintainers under the current no-AI-contribution boundary.",
    "Do not append an overlay registry record except in a separate admission commit bound to the final manifest hash and a passed independent replay.",
    "Any change to reviewed authority, payload, proof, build, validation, visual-QA, or replay bytes invalidates the replay and requires a new review."
  ],
  "generated_at_utc": "2026-08-22T01:01:32Z"
}
