{
  "$schema": "../../../../schemas/candidate-manifest.schema.json",
  "schema": "mathematics-commons-stacks-candidate-manifest/v1",
  "candidate_id": "stacks-errata-a04446e-r1",
  "lease_id": "stacks-lease-000004-errata",
  "namespace": "commons/stacks/errata",
  "writer_task": "01a0256d-5693-77c1-96b2-cf37101e0c6c",
  "upstream": {
    "lock": "upstream/stacks.lock.json",
    "commit": "a04446e57ec1fbc252a871afcec7752fb2807b14",
    "tree": "3feeb703b931a6e7259782c10e7d1575adc83e5e"
  },
  "source_authorities": [
    {"path":"authority/upstream.lock.json","sha256":"B195ECC83AB0F32C574A60D1FDBA9B0DA4D35B04E0DF7CB106DC9C0FDAD99C0D","source_url":"https://github.com/stacks/stacks-project/tree/a04446e57ec1fbc252a871afcec7752fb2807b14"},
    {"path":"authority/COPYING","sha256":"4B2C8FC390F802CD92F0622DC00A708A588BEC54D0145D2EE135D6D7672BFE85","source_url":"https://raw.githubusercontent.com/stacks/stacks-project/a04446e57ec1fbc252a871afcec7752fb2807b14/COPYING"},
    {"path":"authority/ERRATA_LEDGER.jsonl","sha256":"23A9DDA3B5419E31A81598FDC95F5DBAAC6B65AF54E1B0EAC80D06ADB107F332"},
    {"path":"authority/producer-hashes.json","sha256":"916A6DC09AB996DEE4CBE213D7EA271E60D6B4B0695C797F0BE58DCCF8894D55"},
    {"path":"authority/scripts/add_tags.py","sha256":"0DABED0680C4D0CEAF673CAF145B19ED9A838D936C4E5E1688DE508CC58DEB91"},
    {"path":"authority/scripts/functions.py","sha256":"6E26FB192D0DB45CD533BE8719A26DFF4D353956B9EF615C269491813DFE0382"},
    {"path":"authority/source/smoothing.tex","sha256":"FD28CF874BB7DAD3C5C5FF03314D1C83701613A8A98730A99B9CA7A4BCFE6068"},
    {"path":"authority/source/crystalline.tex","sha256":"466C0634A5E8E3899B157A42A4B4BB5F4357199F96708CAF5854F5A92BE58054"},
    {"path":"authority/source/spaces-cohomology.tex","sha256":"63F19991B7B2BCE90B5FB30FCDBB8A3B06CBBFFEC42FA7C413776C29AE4B69C5"},
    {"path":"authority/source/topology.tex","sha256":"C6BAC8DCF8AD96DC47416BF34CB45BA4A10B894E40D67D3E1FA68D8EF0D9F872"},
    {"path":"authority/source/more-morphisms.tex","sha256":"30F7B685A426BD02518CD30BE6F3D8E03646C3D9C1BB7B247B983C739ECB278F"},
    {"path":"authority/source/relative-cycles.tex","sha256":"F2050896436CD590D25869AFF1B6024C1B49D8A763D08EBBDC747F2815618750"},
    {"path":"authority/tags/tags","sha256":"098F77CCE75F8359F1EACB22B7AA0088099B09E5B3FFCAD2DE513CBD1A8A9F1C"}
  ],
  "source_closure": {
    "enumerated": true,
    "expected_units": 14,
    "manifested_units": 14,
    "complete": true
  },
  "stable_unit_manifest": {"path":"stable-units.json","sha256":"F4694DF73A9676EB6B07971EBCA8C96A141DA40B6E7ED8790D8478AA97DA4591"},
  "source_map": {"path":"source-map.jsonl","sha256":"2C37CF2793840E224303BED8DEFC11C7D86407B153278F4924AC558F239E8A10"},
  "decision_ledger": {"path":"decisions.jsonl","sha256":"A1DAD5160C214BC9E86CF152A692FD1F3331A1E06800A04D68470F09A87ED3C6"},
  "rejection_ledger": {"path":"rejections.jsonl","sha256":"3018C074ED299727C2D913C73AA2ECEC8C599DAFF477917E9D91EAA6209A4F61"},
  "formula_diagram_inventory": {"path":"formula-diagram-inventory.json","sha256":"143252ED78E99EFCE833779AE84B5B5F8A04C7660EA41694328E68CBA82374CA"},
  "builds": [
    {"path":".gitattributes","sha256":"705FD4D6451A31D36B3DF7DE96F83F30AC976C9B4A6D1E51671D8E2F33E2D0DA"},
    {"path":"README.md","sha256":"4F9864924A7CCDB22EDCE4703C9BAD47E2EC4F3B166042A5F7010CC6F7BA0E49"},
    {"path":"LEASE.json","sha256":"6208CB7CBD117FCD62D8F648C1681FD2973CF3E5C778C118091D318D55C88355"},
    {"path":"BUILD.md","sha256":"D3ED0A38DB98517D7276DA099C8AF817AB81A52E3D6F3BD03E2DB1A3FD3672B1"},
    {"path":"proofs.md","sha256":"6C1360835004231EA115ECF36501566BA3A48743BF1B06B02BB15EDA19AA068E"},
    {"path":"verify.py","sha256":"44F54047CE7642E079226D334E0729F016EFB58552E5AF878911AF5DFB251899"},
    {"path":"replay-build.py","sha256":"2D2F938FACD9A522041FD146EF1E88661B3242934DDA7C02AC07B99F3B2B34DE"},
    {"path":"build-receipt.py","sha256":"68F1A4C6ECCD0DC763B02E5124E36CC684BA9CD572D5B64155367AF77214BFC2"},
    {"path":"payload/smoothing.tex","sha256":"9CF7DCF31E447C585E81515C9A8059B37A566998DCAFA77A16AB7CB1D27A0A46"},
    {"path":"payload/crystalline.tex","sha256":"EDA38E502E0C6B3743C0FCD769203EAA6186440002A9AD2C97DC6F642B03DEC7"},
    {"path":"payload/spaces-cohomology.tex","sha256":"81438F655CEAB1A2E07CFEEC645A9A7C2447DB983D6BCEFAED6575859B75D196"},
    {"path":"payload/tags/tags","sha256":"C47887DB37D78437C0E7C72BEC0F7840DCA2D36535D1241E1CBCAEF1412DC788"},
    {"path":"builds/tag-allocator.json","sha256":"CA501E77EA54442EB96194E5621B6B2F62F6D06D4EABD1D2EEDD649675A726DA"},
    {"path":"builds/build-execution.json","sha256":"B8A5300A704144079CB700243C99A67134664FCDC4310FEE045B175CFFA8D06E"},
    {"path":"builds/build-receipt.json","sha256":"8B0D259A8E9DE742CAF38FCEA787D93204C210922CD4670B872D1C4A7652F02D"},
    {"path":"builds/validation.json","sha256":"E4CD2E86AA07942A82AD80B460F032979B7749BF52495F507BEFFEFE65251D9A"},
    {"path":"builds/visual-qa.json","sha256":"589D24DCDC938FE8DB2B04DEBC66B010A37CEF8DE2DF5F235C482E86F1FABCC3"},
    {"path":"builds/smoothing.pdf","sha256":"27FC2DEDD20D3F44206B984C35E2C1C8424D849F98C745C0CFD014CFAB397A15"},
    {"path":"builds/smoothing.log","sha256":"2A2112DF42BBD141E07F267B7FA4F39A4AFC1A2C83A1B62278B808C546D1FDD7"},
    {"path":"builds/smoothing.pass3.txt","sha256":"325005208C9047DD7C4B5CE8064FF399F2DA4F7CEA1BDFFB026FDA7F4266F38D"},
    {"path":"builds/smoothing.bibtex.txt","sha256":"D6F481B4F0F80167F38C64D2590976150AC424D7410F5C00F28307F9E438AD57"},
    {"path":"builds/smoothing.authority.pdf","sha256":"AF05D8663D670B0372FFCA89E557EA2D13C1069816E95959135E88691E80FE4E"},
    {"path":"builds/smoothing.authority.log","sha256":"15880EDED24C160F2A639221004903CBE91A3EA9DE0CC5E26EF032B17FE6758A"},
    {"path":"builds/smoothing.authority.pass3.txt","sha256":"492D4B918C6F06A5E3035954067242F02392EAEF823180C59E2C1EEF3EA511D6"},
    {"path":"builds/smoothing.authority.bibtex.txt","sha256":"D6F481B4F0F80167F38C64D2590976150AC424D7410F5C00F28307F9E438AD57"},
    {"path":"builds/crystalline.pdf","sha256":"E4CCB04FAE96EA7D33B4736A499B7D045ED36BA8923A3A76BAFCE9EAB4884C04"},
    {"path":"builds/crystalline.log","sha256":"60A4A07E09F3188C94367FCFA2977903DDC268195311BFDF80772822250957A0"},
    {"path":"builds/crystalline.pass3.txt","sha256":"2B417DF1E1425C90BEBD0D65ADF253AA380454C592FA2877FB2D703E75FA0EC1"},
    {"path":"builds/crystalline.bibtex.txt","sha256":"D45BC72481C8C70A5263B3624F3EB27E9B160C07BDD8CD1D165A03D27D7559D0"},
    {"path":"builds/crystalline.authority.pdf","sha256":"17458285F1D8D371DA7202ACA127702ACC267DA4AEFB4888BC420638B09BABCA"},
    {"path":"builds/crystalline.authority.log","sha256":"60A4A07E09F3188C94367FCFA2977903DDC268195311BFDF80772822250957A0"},
    {"path":"builds/crystalline.authority.pass3.txt","sha256":"2B417DF1E1425C90BEBD0D65ADF253AA380454C592FA2877FB2D703E75FA0EC1"},
    {"path":"builds/crystalline.authority.bibtex.txt","sha256":"D45BC72481C8C70A5263B3624F3EB27E9B160C07BDD8CD1D165A03D27D7559D0"},
    {"path":"builds/spaces-cohomology.pdf","sha256":"1D7E0664E873CAACC4F5FCCEF85398C9BD5EEC57A1BFF5A1807B7A930385D51F"},
    {"path":"builds/spaces-cohomology.log","sha256":"D5E33919CFA6195BC688EF8B2FB2BF334D415B4C7E8A25736B709B9C7215A3AA"},
    {"path":"builds/spaces-cohomology.pass3.txt","sha256":"2B4129D5F84040A624AA8DF4E7B9F6376EFD09D4F645478C8B1FDF1D14E2A0D2"},
    {"path":"builds/spaces-cohomology.bibtex.txt","sha256":"D9034A16FDBFA59A34512FF4EC8F42E4CEF0935D60FDF3295E44177FBD4D9457"},
    {"path":"builds/spaces-cohomology.authority.pdf","sha256":"8B7A40311DC1FB07C09ACAAD9ABB3DB26A9231E43FACD9BB7EDEACEC66035E4D"},
    {"path":"builds/spaces-cohomology.authority.log","sha256":"1A9FBC7FEC0A40843812C0967672996ED8B221A1DC59CDBE9AE66B4FA7FEC051"},
    {"path":"builds/spaces-cohomology.authority.pass3.txt","sha256":"752317495ADFED15CC2E2BC146BF20AC0E2F4B7A891B2D8B7FF3516CEA9AC7F1"},
    {"path":"builds/spaces-cohomology.authority.bibtex.txt","sha256":"D9034A16FDBFA59A34512FF4EC8F42E4CEF0935D60FDF3295E44177FBD4D9457"},
    {"path":"replay/independent-review.json","sha256":"32A3C581306E121D5CCE551B3021B99328AC766B69D6C88EF460F609EAA615E6"}
  ],
  "rights_state": "The authority and modified payload retain the Stacks Project GNU Free Documentation License 1.2; metadata and receipts do not relicense upstream content. This is an independently maintained AI-produced candidate with no Stacks Project review, approval, affiliation, or endorsement. Legal certification was not performed.",
  "review_state": "performed",
  "independent_replay": "passed",
  "unresolved_defects": [
    "The isolated proof builds retain the same cross-chapter undefined-reference sets as their byte-bound authority builds; only a full-corpus build can resolve them.",
    "The isolated proof PDFs are untagged; accessibility tagging remains a full-edition toolchain concern.",
    "Overlay admission, derived-fork composition, and any cumulative CJK release are separate transitions and are not claimed by this candidate."
  ],
  "stop_conditions": [
    "Do not mutate the literal stacks-project master mirror.",
    "Do not apply these corrections silently to canonical translation source or PDFs.",
    "Do not contact or submit to the upstream Stacks maintainers under the current no-AI-contribution boundary.",
    "Do not append an overlay registry record except in a separate admission commit bound to this manifest hash and the passed independent replay.",
    "Any change to a reviewed authority, payload, proof, build, validation, visual-QA, or replay byte invalidates the replay and requires a new review."
  ],
  "generated_at_utc": "2026-08-21T21:03:55Z"
}
